"Product Name","Scientific Name","Category","Form","Potency/Size","Wholesale Price (₹)","Image 1 (Filename)","Image 2 (Filename)","Image 3 (Filename)","Image 4 (Filename)","Description"
"Nature Nook Organic Sandalwood Face Pack Powder for Glowing Skin- 100g","","Cosmetic","POWDER","100g","199","","","","","Nature Nook Organic Sandalwood Face Pack Powder is a premium quality herbal skincare solution designed to restore your skin’s natural glow and clarity. Enriched with pure chandan powder, this natural face pack helps reduce suntan, dark spots, pigmentation, and uneven skin tone while promoting healthy and radiant skin. Sandalwood has been used in traditional skincare for centuries due to its cooling, soothing, and anti inflammatory properties that calm irritated skin and prevent acne breakouts. T..."
"Nature Nook Organic Sandalwood Face Pack Powder for Glowing Skin- 200g","","Cosmetic","POWDER","200g","229","","","","","Nature Nook Organic Sandalwood Face Pack Powder is a premium quality herbal skincare solution designed to restore your skin’s natural glow and clarity. Enriched with pure chandan powder, this natural face pack helps reduce suntan, dark spots, pigmentation, and uneven skin tone while promoting healthy and radiant skin. Sandalwood has been used in traditional skincare for centuries due to its cooling, soothing, and anti inflammatory properties that calm irritated skin and prevent acne breakouts. T..."
"Nature Nook Organic SeaBuckthorn Powder","","Cosmetic","POWDER","Standard","","","","","","Nature Nook Sea Buckthorn Powder 250g, made from 100 percent pure and natural sea buckthorn berries. Known as one of nature’s most powerful superfoods, sea buckthorn is naturally rich in vitamin C, omega 3, antioxidants, and essential nutrients that help support overall health and vitality. The berries are carefully sourced and finely milled to preserve maximum nutrition, taste, and freshness. This nutrient rich powder helps strengthen immunity, supports healthy digestion, and promotes glowing s..."
"Nature Nook Organic Shakti Plus Ayurvedic Herbal Powder Combo-Pack of 4 (100g Each)","","Ayurvedic","POWDER","100g","599","","","","",""
"Nature Nook Organic Shankhpushpi Powder-100gm","","Ayurvedic","POWDER","100gm","189","Shankh17.jpg","","","","Nature Nook Shankhpushpi Powder is a quality Ayurvedic herbal supplement made from carefully selected organic Shankhpushpi leaves. Known traditionally as a powerful brain tonic, Shankhpushpi has been used in Ayurveda for centuries to support memory, focus, and overall cognitive health. Our powder is processed using hygienic methods to retain its natural potency, aroma, and active compounds. Sourced from certified organic farms, this herbal powder is shade dried and finely milled to ensure smooth..."
"Nature Nook Organic Shankhpushpi Powder-250gm","","Ayurvedic","POWDER","250gm","249","Shankh17.jpg","","","",""
"Nature Nook Organic Shatavari Powder-100gm","","Nutraceutical","POWDER","100gm","199","Shatavari7.jpg","","","","Nature Nook Shatavari Powder is a premium quality herbal supplement made from carefully sourced USDA Organic Asparagus Racemosus roots. Traditionally used in Ayurveda, Shatavari is known as a powerful rejuvenating herb that supports women’s health, hormonal balance, and overall wellness. This finely milled powder ensures better absorption and easy consumption for maximum benefits. Shatavari is widely known for its adaptogenic properties that help the body manage stress, fatigue, and hormonal flu..."
"Nature Nook Organic Spirulina Powder-100gm","","Cosmetic","POWDER","100gm","259","Spirulina11.jpg","","","","Boost your daily nutrition with Nature Nook Spirulina Powder, quality USDA organic superfood made from 100 percent pure and natural blue green algae. Carefully sourced and finely milled, this spirulina powder delivers powerful nutrients to support overall health and wellness. Rich in plant based protein, vitamins, minerals, antioxidants, and essential amino acids, spirulina is known to help improve energy levels, strengthen immunity, and support detoxification. Nature Nook Spirulina Powder is fr..."
"Nature Nook Organic Spirulina Powder-250gm","","Cosmetic","POWDER","250gm","499","Spirulina11.jpg","","","","Boost your daily nutrition with Nature Nook Spirulina Powder, a premium quality USDA organic superfood made from 100 percent pure and natural blue green algae. Carefully sourced and finely milled, this spirulina powder delivers powerful nutrients to support overall health and wellness. Rich in plant based protein, vitamins, minerals, antioxidants, and essential amino acids, spirulina is known to help improve energy levels, strengthen immunity, and support detoxification. Nature Nook Spirulina Po..."
"Nature Nook Organic Triphala Powder","","Ayurvedic","POWDER","Standard","","Triphala23.jpg","","","","Support your digestive health naturally with Nature Nook Organic Triphala Powder 250g, a traditional Ayurvedic formulation made from a blend of three powerful fruits Haritaki Bibhitaki and Amalaki. This USDA certified organic powder is 100 percent pure and natural, prepared using time tested methods to retain maximum nutritional value and herbal potency. Triphala is known in Ayurveda for its gentle detoxifying and cleansing properties. It helps improve digestion, supports healthy bowel movement,..."
"Nature Nook Organic Triphala Powder- 100g","","Ayurvedic","POWDER","100g","159","Triphala23.jpg","","","","Support your digestive health naturally with Nature Nook Organic Triphala Powder 100g, a traditional Ayurvedic formulation made from a blend of three powerful fruits Haritaki Bibhitaki and Amalaki. This USDA certified organic powder is 100 percent pure and natural, prepared using time tested methods to retain maximum nutritional value and herbal potency. Triphala is known in Ayurveda for its gentle detoxifying and cleansing properties. It helps improve digestion, supports healthy bowel movement,..."
"Nature Nook Organic Triphala Powder- 250g","","Ayurvedic","POWDER","250g","225","Triphala23.jpg","","","","Support your digestive health naturally with Nature Nook Organic Triphala Powder 250g, a traditional Ayurvedic formulation made from a blend of three powerful fruits Haritaki Bibhitaki and Amalaki. This USDA certified organic powder is 100 percent pure and natural, prepared using time tested methods to retain maximum nutritional value and herbal potency. Triphala is known in Ayurveda for its gentle detoxifying and cleansing properties. It helps improve digestion, supports healthy bowel movement,..."
"Nature Nook Rosemary Leaves","","Cosmetic","POWDER","Standard","","","","","","Nature Nook Rosemary is a premium quality natural dried herb known for its versatile uses in hair care, skincare, cooking, and aromatherapy. Carefully sourced and processed to preserve its natural aroma and properties, rosemary has been widely used for centuries as a trusted herbal ingredient in daily wellness routines. This natural herb is especially popular in hair care practices, where it is commonly used to support scalp care and improve the overall appearance of hair. It can be infused into..."
"Nature Nook Rosemary Leaves 100gm","","Cosmetic","POWDER","100gm","175","","","","","Nature Nook Rosemary is a premium quality natural dried herb known for its versatile uses in hair care, skincare, cooking, and aromatherapy. Carefully sourced and processed to preserve its natural aroma and properties, rosemary has been widely used for centuries as a trusted herbal ingredient in daily wellness routines. This natural herb is especially popular in hair care practices, where it is commonly used to support scalp care and improve the overall appearance of hair. It can be infused into..."
"Nature Nook Rosemary Leaves 200gm","","Cosmetic","POWDER","200gm","249","","","","","Nature Nook Rosemary is a premium quality natural dried herb known for its versatile uses in hair care, skincare, cooking, and aromatherapy. Carefully sourced and processed to preserve its natural aroma and properties, rosemary has been widely used for centuries as a trusted herbal ingredient in daily wellness routines. This natural herb is especially popular in hair care practices, where it is commonly used to support scalp care and improve the overall appearance of hair. It can be infused into..."
"Nature Nook Safed Musli Powder","","Nutraceutical","POWDER","Standard","","Musli10.jpg","","","","Nature Nook Safed Musli Powder 250g, made from 100 percent pure and USDA organic safed musli roots. Safed musli is a highly valued Ayurvedic herb traditionally used to support strength, stamina, and overall vitality. Carefully sourced from trusted farms and finely milled, this premium herbal powder retains maximum nutrients and natural potency. Nature Nook Safed Musli Powder helps boost energy levels, improve physical endurance, and support muscle strength. It is commonly used to promote immunit..."
"Nature Nook Safed Musli Powder- 250g","","Nutraceutical","POWDER","250g","649","Musli10.jpg","","","","Nature Nook Safed Musli Powder 250g, made from 100 percent pure and USDA organic safed musli roots. Safed musli is a highly valued Ayurvedic herb traditionally used to support strength, stamina, and overall vitality. Carefully sourced from trusted farms and finely milled, this premium herbal powder retains maximum nutrients and natural potency. Nature Nook Safed Musli Powder helps boost energy levels, improve physical endurance, and support muscle strength. It is commonly used to promote immunit..."
"Nature Nook Shankhpushpi Powder","","Ayurvedic","POWDER","Standard","","Shankh17.jpg","","","","Nature Nook Shankhpushpi Powder is a quality Ayurvedic herbal supplement made from carefully selected organic Shankhpushpi leaves. Known traditionally as a powerful brain tonic, Shankhpushpi has been used in Ayurveda for centuries to support memory, focus, and overall cognitive health. Our powder is processed using hygienic methods to retain its natural potency, aroma, and active compounds. Sourced from certified organic farms, this herbal powder is shade dried and finely milled to ensure smooth..."
"Nature Nook Shatavari Powder","","Nutraceutical","POWDER","Standard","","Shatavari7.jpg","","","","Nature Nook Shatavari Powder is a premium quality herbal supplement made from carefully sourced USDA Organic Asparagus Racemosus roots. Traditionally used in Ayurveda, Shatavari is known as a powerful rejuvenating herb that supports women’s health, hormonal balance, and overall wellness. This finely milled powder ensures better absorption and easy consumption for maximum benefits. Shatavari is widely known for its adaptogenic properties that help the body manage stress, fatigue, and hormonal flu..."
"Nature Nook Shatavari Powder-250gm","","Nutraceutical","POWDER","250gm","225","Shatavari7.jpg","","","","Nature Nook Shatavari Powder is a premium quality herbal supplement made from carefully sourced USDA Organic Asparagus Racemosus roots. Traditionally used in Ayurveda, Shatavari is known as a powerful rejuvenating herb that supports women’s health, hormonal balance, and overall wellness. This finely milled powder ensures better absorption and easy consumption for maximum benefits. Shatavari is widely known for its adaptogenic properties that help the body manage stress, fatigue, and hormonal flu..."
"Nature Nook Skincare Powder Combo- Pack of 3","","Cosmetic","POWDER","Standard","587","","","","","Nature Nook Skincare Powder Combo Pack of 3 is a complete herbal skincare solution designed to cleanse, nourish and rejuvenate your skin naturally. This combo typically includes Multani Mitti, Sandalwood Powder and Neem Powder, all known for their powerful skin enhancing properties. Made from 100 percent natural ingredients, this combo is free from harmful chemicals, making it a safe and effective choice for daily or weekly skincare routines. Multani Mitti works as a natural cleanser that absorb..."
"Nature Nook Spirulina Powder","","Nutraceutical","POWDER","Standard","","Spirulina11.jpg","","","",""
"Nature NookBrahmi Powder- 250g For Men & Women","","Cosmetic","POWDER","250g","249","Brahmi15.jpg","","","","Enhance your beauty and wellness routine with Nature Nook Brahmi Powder 250g, made from 100 percent pure and natural brahmi leaves. Widely used in Ayurveda, brahmi is known for its powerful benefits for hair care, skin nourishment, and mental wellness. This finely milled herbal powder is carefully processed to retain maximum nutrients and natural potency. Nature Nook Brahmi Powder helps promote healthy hair growth, strengthens hair roots, reduces hair fall, and supports dandruff control. When us..."