"Product Name","Scientific Name","Category","Form","Potency/Size","Wholesale Price (₹)","Image 1 (Filename)","Image 2 (Filename)","Image 3 (Filename)","Image 4 (Filename)","Description"
"Himalayan Sea Buckthorn Powder-100gm","","Cosmetic","POWDER","100gm","299","SeaBuck5.jpg","","","",""
"NATURE NOOK Ashwagandha Capsules 500mg with Root Extract","","Nutraceutical","CAPSULE_EXTRACT","Standard","325","Ashwagandha3.jpg","","","",""
"NATURE NOOK Ayurvedic Strength Energy Stamina Booster","","Nutraceutical","CAPSULE_EXTRACT","Standard","","","","","","NATURE NOOK Ayurvedic Strength Energy Stamina Booster Combo is a powerful herbal blend of three premium supplements – Shilajit Gold Capsules, Ashwagandha Capsules, and Moringa Capsules – designed to support complete physical and mental wellness naturally. This pack of three offers holistic health benefits using traditional Ayurvedic ingredients combined with modern nutrition science. Shilajit Gold Capsules contain pure Shilajit blended with Ashwagandha, Safed Musli, Gokhru, Shatavari, and Swarn ..."
"NATURE NOOK Bhringraj Powder","","Cosmetic","POWDER","Standard","","Bhringraj22.jpg","","","","NATURE NOOK Bhringraj Powder is a premium-quality botanical leaf powder carefully prepared from selected bhringraj leaves and processed to maintain its natural texture, aroma, and traditional value. Known in traditional routines as a key herbal ingredient, bhringraj has long been used in personal care applications, especially in hair-focused rituals and DIY beauty practices. This finely ground bhringraj powder features a smooth, consistent texture that blends easily with oils, water, aloe gel, o..."
"NATURE NOOK Bhringraj Powder-100gm","","Cosmetic","POWDER","100gm","179","Bhringraj22.jpg","","","",""
"NATURE NOOK Bhringraj Powder-250gm","","Cosmetic","POWDER","250gm","249","Bhringraj22.jpg","","","",""
"NATURE NOOK Immunity and Energy Booster Combo- Pack of 3 (Each 100gm)","","Nutraceutical","POWDER","100gm","449","","","","",""
"NATURE NOOK Immunity and Energy Booster Combo-Pack of 3","","Cosmetic","POWDER","Standard","","","","","","NATURE NOOK Immunity and Energy Booster Combo is a powerful blend of three premium herbal superfoods – Ashwagandha, Seabuckthorn, and Moringa Powder – carefully curated to support overall health, stamina, and natural immunity. This pack of three combines ancient Ayurvedic wisdom with modern nutritional science to help you achieve daily wellness goals naturally. Ashwagandha is a well-known adaptogenic herb that helps manage stress, improve energy levels, enhance endurance, and support mental clar..."
"NATURE NOOK Madhu Nashini Combo-Pack of 3 (Each 100gm)","","Ayurvedic","POWDER","100gm","349","","","","",""
"NATURE NOOK Moringa Capsules 500mg","","Nutraceutical","CAPSULE_EXTRACT","Standard","299","Moringa1.jpg","","","",""
"NATURE NOOK Shilajit Gold Capsules 500mg with Ashwagandha, Safed Musli, Gokhru, Shatavari Swarn Bhasma","","Nutraceutical","CAPSULE_EXTRACT","Standard","399","Ashwagandha3.jpg","","","",""
"NATURE NOOK Superfood and Body Detox Combo- Pack of 3 (Each 100gm)","","Nutraceutical","POWDER","100gm","399","","","","","NATURE NOOK Superfood and Body Detox Combo is a powerful blend of three premium herbal powders – Ashwagandha, Beetroot, and Moringa – carefully formulated to cleanse the body, improve digestion, boost energy, and strengthen immunity naturally. This pack of three provides complete daily nutrition using ancient Ayurvedic wisdom and modern wellness science. Ashwagandha is a potent adaptogenic herb that helps reduce stress, balance hormones, improve stamina, and enhance mental focus. It supports bet..."
"Nature Nook Beetroot Powder","","Nutraceutical","POWDER","Standard","","Beetroot13.jpg","","","","Improve your daily nutrition with Nature Nook Beetroot Powder 250g, made from 100 percent pure and USDA organic beetroots. Carefully sourced and finely milled, this natural superfood retains maximum nutrients, taste, and freshness. Beetroot is well known for supporting blood health, improving circulation, and boosting natural energy levels. This FSSAI certified powder ensures safety, quality, and hygiene in every serving. Nature Nook Beetroot Powder is rich in iron, antioxidants, dietary fiber, ..."
"Nature Nook Beetroot Powder-250gm","","Nutraceutical","POWDER","250gm","199","Beetroot13.jpg","","","",""
"Nature Nook Brahmi Powder","","Cosmetic","POWDER","Standard","","Brahmi15.jpg","","","","Enhance your beauty and wellness routine with Nature Nook Brahmi Powder 100g, made from 100 percent pure and natural brahmi leaves. Widely used in Ayurveda, brahmi is known for its powerful benefits for hair care, skin nourishment, and mental wellness. This finely milled herbal powder is carefully processed to retain maximum nutrients and natural potency. Nature Nook Brahmi Powder helps promote healthy hair growth, strengthens hair roots, reduces hair fall, and supports dandruff control. When us..."
"Nature Nook Chhoti Harad","","Ayurvedic","POWDER","Standard","","","","","","Nature Nook Chhoti Harad is a premium quality natural herbal product widely used in Ayurveda for its traditional wellness benefits. Also known as Haritaki, this dried whole herb has been valued for centuries as a key ingredient in herbal formulations, especially in Triphala, one of the most popular Ayurvedic blends. Carefully sourced and processed to maintain its natural properties, Chhoti Harad is known for supporting digestive wellness and promoting overall balance in the body. It is commonly ..."
"Nature Nook Chhoti Harad 100gm","","Ayurvedic","POWDER","100gm","199","","","","","Nature Nook Chhoti Harad is a premium quality natural herbal product widely used in Ayurveda for its traditional wellness benefits. Also known as Haritaki, this dried whole herb has been valued for centuries as a key ingredient in herbal formulations, especially in Triphala, one of the most popular Ayurvedic blends. Carefully sourced and processed to maintain its natural properties, Chhoti Harad is known for supporting digestive wellness and promoting overall balance in the body. It is commonly ..."
"Nature Nook Chhoti Harad 200gm","","Ayurvedic","POWDER","200gm","249","","","","","Nature Nook Chhoti Harad is a premium quality natural herbal product widely used in Ayurveda for its traditional wellness benefits. Also known as Haritaki, this dried whole herb has been valued for centuries as a key ingredient in herbal formulations, especially in Triphala, one of the most popular Ayurvedic blends. Carefully sourced and processed to maintain its natural properties, Chhoti Harad is known for supporting digestive wellness and promoting overall balance in the body. It is commonly ..."
"Nature Nook Fitkari","","Cosmetic","POWDER","100 gm","179","","","","","Nature Nook Fitkari 100gm is a premium quality natural alum crystal known for its versatile benefits in skincare, hygiene, and traditional household uses. Sourced and processed with care, this pure potassium alum is widely used in Ayurvedic practices for its natural antiseptic and antibacterial properties. Fitkari has been trusted for generations as an effective after-shave solution that helps soothe skin irritation and minor cuts caused by shaving. Its natural astringent properties help tighten..."
"Nature Nook Fitkari","","Cosmetic","POWDER","200gm","225","","","","","Nature Nook Fitkari 200gm is a premium quality natural alum crystal known for its versatile benefits in skincare, hygiene, and traditional household uses. Sourced and processed with care, this pure potassium alum is widely used in Ayurvedic practices for its natural antiseptic and antibacterial properties. Fitkari has been trusted for generations as an effective after-shave solution that helps soothe skin irritation and minor cuts caused by shaving. Its natural astringent properties help tighten..."
"Nature Nook Fitkari","","Cosmetic","POWDER","Standard","","","","","","Nature Nook Fitkari 100gm is a premium quality natural alum crystal known for its versatile benefits in skincare, hygiene, and traditional household uses. Sourced and processed with care, this pure potassium alum is widely used in Ayurvedic practices for its natural antiseptic and antibacterial properties. Fitkari has been trusted for generations as an effective after-shave solution that helps soothe skin irritation and minor cuts caused by shaving. Its natural astringent properties help tighten..."
"Nature Nook Gudmar Powder","","Ayurvedic","POWDER","Standard","","Gudmar19.jpg","","","","Nature Nook Gudmar Powder is a premium quality herbal supplement made from carefully selected Gymnema Sylvestre leaves, traditionally known as “Gurmar” or “sugar destroyer.” Sourced from certified organic farms, this USDA Organic Gudmar Powder is processed using hygienic methods to retain its natural potency, aroma, and nutritional profile. The leaves are shade dried and finely milled to deliver a smooth texture that blends easily into water, smoothies, or herbal preparations. Gudmar has been us..."
"Nature Nook Henna Mehndi and Indigo Powder Combo for Natural Hair Coloring","","Cosmetic","POWDER","Standard","299","","","","","Nature Nook Henna Mehndi and Indigo Powder is a premium natural hair coloring solution designed for those who prefer safe, herbal alternatives to chemical dyes. This powerful combination of finely sifted henna and indigo powder helps you achieve rich black or brown shades while also nourishing your hair from root to tip. Made from 100 percent pure plant based ingredients, this hair dye is free from harmful chemicals like ammonia, PPD, parabens and artificial additives, making it ideal for regula..."
"Nature Nook Henna Powder","","Cosmetic","POWDER","100gm","149","","","","","Nature Nook Organic Henna Powder is a premium quality natural green heena powder specially crafted for safe and effective hair colouring and deep hair nourishment. Sourced from carefully selected henna leaves and finely processed to preserve its natural properties, this herbal hair care powder delivers rich colour while strengthening and conditioning your hair from root to tip. Unlike chemical hair dyes that may damage hair texture and scalp health, this organic henna powder works gently to prov..."
"Nature Nook Henna Powder","","Cosmetic","POWDER","200gm","199","","","","","Nature Nook Organic Henna Powder is a premium quality natural green heena powder specially crafted for safe and effective hair colouring and deep hair nourishment. Sourced from carefully selected henna leaves and finely processed to preserve its natural properties, this herbal hair care powder delivers rich colour while strengthening and conditioning your hair from root to tip. Unlike chemical hair dyes that may damage hair texture and scalp health, this organic henna powder works gently to prov..."
"Nature Nook Himalayan Sea Buckthorn Powder-250gm","","Cosmetic","POWDER","250gm","449","SeaBuck5.jpg","","","",""
"Nature Nook Indigo Powder","","Cosmetic","POWDER","Standard","","","","","","Get naturally dark and healthy-looking hair with Nature Nook Indigo Powder Pack of 2, a 100% herbal and chemical-free hair dye solution. Made from premium quality indigo leaves, this natural hair color helps cover grey hair effectively while nourishing your scalp and strengthening hair strands. Unlike synthetic hair dyes, this herbal indigo powder does not contain ammonia, PPD, parabens, or artificial colors, making it safe for regular use. Indigo powder works best when used after henna applicat..."
"Nature Nook Kalmegh Powder -100g","","Ayurvedic","POWDER","100g","195","","","","","Nature Nook Kalmegh Powder, also known as Nilavembu Kashayam Powder, is a premium quality herbal powder prepared from carefully selected Kalmegh leaves. Widely recognized in traditional Ayurvedic practices, Kalmegh is known by various regional names including Nelavemu, Chirata and Kirayata. This potent herb has been traditionally used to support immunity, digestive health and overall wellness. Our Kalmegh powder is finely processed to preserve its natural properties and maintain maximum potency...."
"Nature Nook Kalmegh Powder -200g","","Ayurvedic","POWDER","200g","195","","","","","Nature Nook Kalmegh Powder, also known as Nilavembu Kashayam Powder, is a premium quality herbal powder prepared from carefully selected Kalmegh leaves. Widely recognized in traditional Ayurvedic practices, Kalmegh is known by various regional names including Nelavemu, Chirata and Kirayata. This potent herb has been traditionally used to support immunity, digestive health and overall wellness. Our Kalmegh powder is finely processed to preserve its natural properties and maintain maximum potency...."
"Nature Nook Kasturi Haldi 100gm","","Cosmetic","POWDER","100gm","199","","","","","Nature Nook Kasturi Haldi is a premium quality wild turmeric carefully processed to support traditional skin care rituals. Known as Kasturi Manjal, this variety of turmeric is widely used in face packs and ubtan preparations for improving skin clarity, glow, and overall appearance. Unlike regular kitchen turmeric, Kasturi Haldi is specially valued for cosmetic use and is commonly included in natural beauty routines. Wild turmeric has been traditionally used for managing acne prone skin, reducing..."
"Nature Nook Kasturi Haldi 200gm","","Cosmetic","POWDER","200gm","289","","","","","Nature Nook Kasturi Haldi is a premium quality wild turmeric carefully processed to support traditional skin care rituals. Known as Kasturi Manjal, this variety of turmeric is widely used in face packs and ubtan preparations for improving skin clarity, glow, and overall appearance. Unlike regular kitchen turmeric, Kasturi Haldi is specially valued for cosmetic use and is commonly included in natural beauty routines. Wild turmeric has been traditionally used for managing acne prone skin, reducing..."
"Nature Nook Masoor Dal Powder 100gm for Skin Care","","Cosmetic","POWDER","100gm","179","","","","","Nature Nook Masoor Dal Powder is a premium quality red lentils seed powder specially crafted for natural skin care and traditional beauty treatments. Finely ground from carefully selected masoor dal seeds, this powder works as an excellent natural exfoliator and cleansing agent for all skin types. It is widely used in homemade face packs, ubtan, and herbal skin care routines to promote healthy, glowing, and refreshed skin. Masoor dal has been used for generations in natural beauty rituals becaus..."
"Nature Nook Masoor Dal Powder 200gm for Skin Care","","Cosmetic","POWDER","200gm","219","","","","","Nature Nook Masoor Dal Powder is a premium quality red lentils seed powder specially crafted for natural skin care and traditional beauty treatments. Finely ground from carefully selected masoor dal seeds, this powder works as an excellent natural exfoliator and cleansing agent for all skin types. It is widely used in homemade face packs, ubtan, and herbal skin care routines to promote healthy, glowing, and refreshed skin. Masoor dal has been used for generations in natural beauty rituals becaus..."
"Nature Nook Multani Mitti and Sandalwood Powder Combo for Skin Care","","Cosmetic","POWDER","Standard","349","","","","","Nature Nook Multani Mitti and Sandalwood Powder Combo is a natural skincare solution designed to deeply cleanse, purify and rejuvenate your skin. Made from 100 percent pure and finely processed ingredients, this herbal face pack helps remove excess oil, dirt and impurities while enhancing your skin’s natural glow. It is completely free from harmful chemicals, making it safe for regular use on all skin types. Multani Mitti, also known as Fuller’s Earth, is widely known for its oil absorbing and d..."
"Nature Nook Orange Peel Powder-100 Gm for Skin and Face Care","","Cosmetic","POWDER","100 Gm","125","","","","","Nature Nook Orange Peel Powder is a premium quality natural skin care ingredient made from carefully dried and finely processed orange peels. Traditionally used in homemade face packs and ubtan recipes, orange peel is known for its cleansing and brightening properties. This 100 grams pack is ideal for regular use in your weekly skin care routine. Rich in natural citrus properties, orange peel is widely used to support deep cleansing and removal of surface impurities. It helps remove excess oil, ..."
"Nature Nook Orange Peel Powder-200 Gm for Skin and Face Care","","Cosmetic","POWDER","200 Gm","149","","","","","Nature Nook Orange Peel Powder is a premium quality natural skin care ingredient made from carefully dried and finely processed orange peels. Traditionally used in homemade face packs and ubtan recipes, orange peel is known for its cleansing and brightening properties. This 200 grams pack is ideal for regular use in your weekly skin care routine. Rich in natural citrus properties, orange peel is widely used to support deep cleansing and removal of surface impurities. It helps remove excess oil, ..."
"Nature Nook Organic Amla, Reetha, Bhringraj, Shikakai & Hibiscus Powder Combo for Hair Growth (100 grams each) with Brush and Cap -Pack of 5,Anti Hair Fall, Dandruff Control Kit","","Cosmetic","POWDER","100 g","325","Bhringraj22.jpg","","","",""
"Nature Nook Organic Amla, Reetha, Bhringraj, Shikakai & Hibiscus Powder Combo for Hair Growth (50 grams each) with Brush and Cap -Pack of 5,Anti Hair Fall, Dandruff Control Kit","","Cosmetic","POWDER","50 g","229","Bhringraj22.jpg","","","",""
"Nature Nook Organic Amla, Reetha, Bhringraj, Shikakai & Hibiscus Powder Combo for Hair Growth with Brush and Cap -Pack of 5,Anti Hair Fall, Dandruff Control Kit","","Cosmetic","POWDER","Standard","","Bhringraj22.jpg","","","","Transform your hair care routine naturally with the Nature Nook Herbal Hair Care Powder Combo, a powerful blend of Amla, Bhringraj, Hibiscus, Shikakai, and Aritha Reetha. Specially curated for complete scalp and hair nourishment, this organic and food-grade herbal kit helps promote hair growth, reduce hair fall, fight dandruff, and restore natural shine. Amla powder is rich in Vitamin C that strengthens hair roots and prevents premature greying. Bhringraj, known as the “King of Herbs,” deeply no..."
"Nature Nook Organic Ashwagandha Powder","","Nutraceutical","POWDER","Standard","","Ashwagandha3.jpg","","","","Pure Ashwagandha Powder is made from Pure Withania Somnifera roots, traditionally used in Ayurveda for centuries to support overall health and well being. This 100 percent natural herbal powder helps improve immunity, manage stress, enhance energy levels, and support physical strength. Carefully processed to retain its natural properties, this ashwagandha root powder delivers maximum potency and effectiveness. Ashwagandha is known as an adaptogenic herb that helps the body cope with daily stress..."
"Nature Nook Organic Ashwagandha Powder-100gm","","Nutraceutical","POWDER","100gm","199","Ashwagandha3.jpg","","","","Pure Ashwagandha Powder is made from Pure Withania Somnifera roots, traditionally used in Ayurveda for centuries to support overall health and well being. This 100 percent natural herbal powder helps improve immunity, manage stress, enhance energy levels, and support physical strength. Carefully processed to retain its natural properties, this ashwagandha root powder delivers maximum potency and effectiveness. Ashwagandha is known as an adaptogenic herb that helps the body cope with daily stress..."
"Nature Nook Organic Ashwagandha Powder-250gm","","Nutraceutical","POWDER","250gm","229","Ashwagandha3.jpg","","","",""
"Nature Nook Organic Beetroot Powder-100gm","","Nutraceutical","POWDER","100gm","159","Beetroot13.jpg","","","",""
"Nature Nook Organic Black Kaunch Beej Powder","","Nutraceutical","POWDER","Standard","","Kaunch25.jpg","","","","Nature Nook Black Kaunch Beej Powder 250g, made from carefully selected Mucuna Pruriens seeds, also known as Kapikachhu, Alkushi, or Velvet Beans. This finely milled herbal powder is prepared using traditional methods to preserve its natural potency and nutritional profile. Kaunch beej has been widely used in Ayurveda for centuries to support strength, stamina, and overall vitality. Regular use may help improve energy levels, enhance physical performance, and support hormonal balance. It is also..."
"Nature Nook Organic Black Kaunch Beej Powder- 100g","","Ayurvedic","POWDER","100g","199","Kaunch25.jpg","","","",""
"Nature Nook Organic Black Kaunch Beej Powder- 250g","","Nutraceutical","POWDER","250g","249","Kaunch25.jpg","","","","Nature Nook Black Kaunch Beej Powder 250g, made from carefully selected Mucuna Pruriens seeds, also known as Kapikachhu, Alkushi, or Velvet Beans. This finely milled herbal powder is prepared using traditional methods to preserve its natural potency and nutritional profile. Kaunch beej has been widely used in Ayurveda for centuries to support strength, stamina, and overall vitality. Regular use may help improve energy levels, enhance physical performance, and support hormonal balance. It is also..."
"Nature Nook Organic Gudmar Powder-100gm","","Ayurvedic","POWDER","100gm","189","Gudmar19.jpg","","","",""
"Nature Nook Organic Gudmar Powder-250gm","","Ayurvedic","POWDER","250gm","249","Gudmar19.jpg","","","",""
"Nature Nook Organic Indigo Powder with Brush-100gm (Pack of 1)","","Cosmetic","POWDER","100gm","149","","","","","Get naturally dark and healthy-looking hair with Nature Nook Indigo Powder Pack of 2, a 100% herbal and chemical-free hair dye solution. Made from premium quality indigo leaves, this natural hair color helps cover grey hair effectively while nourishing your scalp and strengthening hair strands. Unlike synthetic hair dyes, this herbal indigo powder does not contain ammonia, PPD, parabens, or artificial colors, making it safe for regular use. Indigo powder works best when used after henna applicat..."
"Nature Nook Organic Indigo Powder with Cap & Brush -100gm (Pack of 2)","","Cosmetic","POWDER","100gm","249","","","","","Get naturally dark and healthy-looking hair with Nature Nook Indigo Powder Pack of 2, a 100% herbal and chemical-free hair dye solution. Made from premium quality indigo leaves, this natural hair color helps cover grey hair effectively while nourishing your scalp and strengthening hair strands. Unlike synthetic hair dyes, this herbal indigo powder does not contain ammonia, PPD, parabens, or artificial colors, making it safe for regular use. Indigo powder works best when used after henna applicat..."
"Nature Nook Organic Moringa Leaf Powder","","Nutraceutical","POWDER","Standard","","Moringa1.jpg","","","","Boost your daily nutrition with Nature Nook Organic Moringa Leaf Powder, a premium USDA certified superfood made from carefully selected drumstick leaves. Known as the miracle tree, moringa is naturally rich in vitamins, minerals, antioxidants, and plant based protein that support overall health and vitality. Our leaves are shade dried and finely milled to preserve maximum nutrients, freshness, and natural taste. Nature Nook Moringa Powder helps strengthen immunity, improve digestion, and increa..."
"Nature Nook Organic Moringa Leaf Powder- 100g","","Nutraceutical","POWDER","100g","189","Moringa1.jpg","","","","Boost your daily nutrition with Nature Nook Organic Moringa Leaf Powder, a premium USDA certified superfood made from carefully selected drumstick leaves. Known as the miracle tree, moringa is naturally rich in vitamins, minerals, antioxidants, and plant based protein that support overall health and vitality. Our leaves are shade dried and finely milled to preserve maximum nutrients, freshness, and natural taste. Nature Nook Moringa Powder helps strengthen immunity, improve digestion, and increa..."
"Nature Nook Organic Moringa Leaf Powder- 250g","","Nutraceutical","POWDER","250g","339","Moringa1.jpg","","","","Boost your daily nutrition with Nature Nook Organic Moringa Leaf Powder, a premium USDA certified superfood made from carefully selected drumstick leaves. Known as the miracle tree, moringa is naturally rich in vitamins, minerals, antioxidants, and plant based protein that support overall health and vitality. Our leaves are shade dried and finely milled to preserve maximum nutrients, freshness, and natural taste. Nature Nook Moringa Powder helps strengthen immunity, improve digestion, and increa..."
"Nature Nook Organic Multani Mitti Powder- 100gm","","Cosmetic","POWDER","100gm","149","","","","","Nature Nook Organic Multani Mitti Powder is a premium quality natural Fuller’s Earth carefully processed to preserve its purity and traditional skincare benefits. Known for its excellent oil absorbing and deep cleansing properties, Multani Mitti has been used for generations as a natural face and hair care remedy. This 100gm pack is ideal for regular use in face packs, hair masks and scalp treatments. Multani Mitti works effectively to cleanse pores by removing dirt, excess oil and impurities fr..."
"Nature Nook Organic Multani Mitti Powder- 200gm","","Cosmetic","POWDER","200gm","149","","","","","Nature Nook Organic Multani Mitti Powder is a premium quality natural Fuller’s Earth carefully processed to preserve its purity and traditional skincare benefits. Known for its excellent oil absorbing and deep cleansing properties, Multani Mitti has been used for generations as a natural face and hair care remedy. This 200gm pack is ideal for regular use in face packs, hair masks and scalp treatments. Multani Mitti works effectively to cleanse pores by removing dirt, excess oil and impurities fr..."
"Nature Nook Organic Safed Musli Powder- 100g","","Nutraceutical","POWDER","100g","349","Musli10.jpg","","","",""
